{
  "$schema": "https://json-schema.org/draft/2020-12/schema",
  "title": "dsh-go ui.json v1",
  "description": "Declarative layout of the dsh-go phone app's native screens. Strict JSON, at most 64 KiB. Limits that JSON Schema cannot express (at most 3 custom header buttons, labels cut to length, reserved shortcuts) are listed under x-dsh-go and enforced by scripts/check.mjs and the app.",
  "type": "object",
  "required": ["version"],
  "properties": {
    "$schema": { "type": "string" },
    "version": { "const": 1 },
    "header": {
      "type": "object",
      "properties": {
        "actions": {
          "type": "array",
          "items": { "oneOf": [{ "$ref": "#/$defs/headerBuiltin" }, { "$ref": "#/$defs/headerCustom" }] }
        }
      },
      "additionalProperties": false
    },
    "composer": {
      "type": "object",
      "properties": {
        "quickActions": {
          "type": "array",
          "maxItems": 8,
          "items": {
            "type": "object",
            "required": ["label", "action"],
            "properties": {
              "label": { "type": "string", "minLength": 1, "maxLength": 10 },
              "action": { "$ref": "#/$defs/action" }
            },
            "additionalProperties": false
          }
        }
      },
      "additionalProperties": false
    },
    "emptyState": {
      "type": "object",
      "properties": {
        "suggestions": {
          "type": "array",
          "maxItems": 6,
          "items": {
            "type": "object",
            "required": ["title", "action"],
            "properties": {
              "title": { "type": "string", "minLength": 1, "maxLength": 20 },
              "subtitle": { "type": "string", "minLength": 1, "maxLength": 40 },
              "action": { "$ref": "#/$defs/action" }
            },
            "additionalProperties": false
          }
        }
      },
      "additionalProperties": false
    },
    "drawer": {
      "type": "object",
      "properties": {
        "groups": { "type": "array", "uniqueItems": true, "items": { "$ref": "#/$defs/drawerGroup" } },
        "sort": { "$ref": "#/$defs/drawerSort" },
        "filter": { "$ref": "#/$defs/drawerFilter" }
      },
      "additionalProperties": false
    },
    "density": { "$ref": "#/$defs/density" },
    "hide": { "type": "array", "uniqueItems": true, "items": { "$ref": "#/$defs/hideItem" } },
    "theme": {
      "type": "object",
      "properties": {
        "mode": { "$ref": "#/$defs/themeMode" },
        "accentPreset": { "$ref": "#/$defs/accentPreset" },
        "accent": { "type": "string", "pattern": "^#[0-9A-Fa-f]{6}$" }
      },
      "not": { "required": ["accentPreset", "accent"] },
      "additionalProperties": false
    },
    "pet": {
      "type": "object",
      "properties": {
        "id": { "type": "string", "pattern": "^[a-z0-9][a-z0-9-]{0,63}$" },
        "position": { "$ref": "#/$defs/petPosition" },
        "quiet": { "type": "boolean" }
      },
      "additionalProperties": false
    },
    "shortcuts": {
      "type": "array",
      "maxItems": 20,
      "items": {
        "type": "object",
        "required": ["keys", "action"],
        "properties": {
          "keys": { "type": "string", "description": "ctrl / alt / shift joined with +, then one key, e.g. ctrl+k, ctrl+shift+n, f5" },
          "action": { "$ref": "#/$defs/action" }
        },
        "additionalProperties": false
      }
    },
    "plugins": {
      "type": "object",
      "properties": {
        "seats": {
          "type": "object",
          "description": "slot key → npm package name → how its part of that slot shows in the app",
          "propertyNames": { "pattern": "^[a-z][A-Za-z0-9-]*(\\.[A-Za-z0-9-]+)*$" },
          "additionalProperties": {
            "type": "object",
            "propertyNames": { "pattern": "^(@[a-z0-9][a-z0-9._~-]*/)?[a-z0-9][a-z0-9._~-]*$", "maxLength": 214 },
            "additionalProperties": { "$ref": "#/$defs/seatMode" }
          }
        }
      },
      "additionalProperties": false
    }
  },
  "additionalProperties": false,
  "$defs": {
    "headerBuiltin": { "enum": ["newChat", "detail", "schedule", "agents", "model"] },
    "headerCustom": {
      "type": "object",
      "required": ["id", "icon", "label", "action"],
      "properties": {
        "id": { "type": "string", "pattern": "^[a-z][a-zA-Z0-9-]{0,31}$" },
        "icon": { "$ref": "#/$defs/icon" },
        "label": { "type": "string", "minLength": 1, "maxLength": 8 },
        "action": { "$ref": "#/$defs/action" }
      },
      "additionalProperties": false
    },
    "icon": {
      "enum": [
        "bolt", "star", "sparkle", "heart", "flag", "bookmark", "pin", "bell", "clock", "alarm", "calendar",
        "todo", "note", "document", "folder", "search", "code", "terminal", "globe", "chart", "lightbulb",
        "book", "puzzle", "robot", "chat", "mail", "translate", "image", "camera", "mic", "link", "summary",
        "wrench", "bug", "travel", "school", "home", "play", "refresh", "archive", "team", "wallet", "palette"
      ]
    },
    "drawerGroup": { "enum": ["pinned", "folders", "today", "yesterday", "thisWeek", "earlier"] },
    "drawerSort": { "enum": ["activity", "created"] },
    "drawerFilter": { "enum": ["all", "running", "pending", "unread"] },
    "density": { "enum": ["compact", "comfortable"] },
    "hideItem": {
      "enum": ["turnFooter", "tokenCount", "reasoningDetails", "activityStrip", "whaleTail", "todoPill", "goalBar"]
    },
    "themeMode": { "enum": ["system", "light", "dark"] },
    "accentPreset": { "enum": ["mist", "daiqing", "dusk", "turquoise", "amber", "graphite"] },
    "petPosition": { "enum": ["top-left", "top-right", "bottom-left", "bottom-right"] },
    "seatMode": { "enum": ["native", "island", "web", "hidden"] },
    "page": {
      "enum": [
        "session-detail", "artifacts", "files", "terminal", "export", "jobs", "plan-goal", "skills",
        "subagents", "reference", "schedules", "permission", "agent-presets", "models", "subagent-settings",
        "agent-loop", "shell-settings", "web-search", "plugins", "plugin-inventory", "cordis", "agent-team",
        "cot-translation", "voice-input", "forum", "community", "ds-bot", "share-profile", "search",
        "notifications", "workspaces", "general", "account", "remote", "phone", "engine", "diagnostics", "web",
        "new-chat", "settings"
      ]
    },
    "actionType": { "enum": ["send", "open", "command", "link"] },
    "action": {
      "oneOf": [
        {
          "type": "object",
          "required": ["type", "text"],
          "properties": {
            "type": { "const": "send" },
            "text": { "type": "string", "minLength": 1, "maxLength": 2000, "description": "Put into the composer; the person taps send" }
          },
          "additionalProperties": false
        },
        {
          "type": "object",
          "required": ["type", "page"],
          "properties": { "type": { "const": "open" }, "page": { "$ref": "#/$defs/page" } },
          "additionalProperties": false
        },
        {
          "type": "object",
          "required": ["type", "name"],
          "properties": {
            "type": { "const": "command" },
            "name": { "type": "string", "pattern": "^[A-Za-z0-9][A-Za-z0-9:._-]{0,63}$", "description": "Slash command name without the slash" },
            "args": { "type": "string", "maxLength": 500 }
          },
          "additionalProperties": false
        },
        {
          "type": "object",
          "required": ["type", "url"],
          "properties": {
            "type": { "const": "link" },
            "url": { "type": "string", "pattern": "^https://", "maxLength": 2000 }
          },
          "additionalProperties": false
        }
      ]
    }
  },
  "x-dsh-go": {
    "version": 1,
    "maxBytes": 65536,
    "maxDepth": 32,
    "limits": {
      "headerCustomMax": 3,
      "headerLabelMax": 8,
      "quickActionsMax": 8,
      "quickLabelMax": 10,
      "suggestionsMax": 6,
      "suggestionTitleMax": 20,
      "suggestionSubtitleMax": 40,
      "shortcutsMax": 20,
      "sendTextMax": 2000,
      "commandArgsMax": 500,
      "urlMax": 2000
    },
    "shortcutKeys": [
      "a", "b", "c", "d", "e", "f", "g", "h", "i", "j", "k", "l", "m",
      "n", "o", "p", "q", "r", "s", "t", "u", "v", "w", "x", "y", "z",
      "0", "1", "2", "3", "4", "5", "6", "7", "8", "9",
      "f1", "f2", "f3", "f4", "f5", "f6", "f7", "f8", "f9", "f10", "f11", "f12",
      "/", ",", ".", "[", "]", "enter", "up", "down", "left", "right"
    ],
    "systemModifiers": ["meta", "cmd", "command", "win", "super", "os"],
    "reservedShortcuts": ["ctrl+a", "ctrl+c", "ctrl+v", "ctrl+x", "ctrl+y", "ctrl+z", "ctrl+shift+v", "ctrl+shift+z", "alt+f4"],
    "slots": {
      "release": "0.2.1-rc.4",
      "known": ["conversation.approval.detail", "conversation.chat.assistant-actions", "conversation.chat.commandview", "conversation.chat.flow", "conversation.chat.message.images", "conversation.chat.node", "conversation.chat.reasoning.body", "conversation.chat.turnTail", "conversation.chat.user.images", "conversation.composer", "conversation.composer.bar", "conversation.composer.dock", "conversation.header", "conversation.header.leading", "conversation.hero.agentPreset", "conversation.hero.brand.mark", "conversation.hero.options", "conversation.hero.workspace", "conversation.hero.workspace.directoryFlow", "conversation.input.activity", "conversation.input.attachments", "conversation.input.dock", "conversation.input.left", "conversation.input.model", "conversation.input.model.label", "conversation.input.overlay", "conversation.input.permission", "conversation.input.plan", "conversation.input.right", "conversation.plan-review.actions", "conversation.session", "conversation.session.header", "conversation.session.header.actions", "conversation.session.header.corner", "conversation.session.header.lineage", "conversation.session.header.utilities", "conversation.session.header.views.actions", "conversation.trajectory.images", "conversation.user.text.node", "conversation.view", "deliverables.file.actions", "deliverables.review.file.actions", "main", "main.conversation", "plugins.add.actions", "plugins.bundle.activation", "plugins.bundle.config", "plugins.detail.actions", "plugins.detail.badge", "plugins.detail.section", "plugins.item", "plugins.row.config", "plugins.tab", "rightbar", "rightbar.session", "root", "settings.action", "settings.close", "settings.general.item", "settings.header", "settings.launcher", "settings.models.footer", "settings.models.provider-card", "settings.models.sign-in", "settings.onboarding", "settings.plugins.tab", "settings.section", "settings.trigger", "shell.bottom", "shell.leading", "shell.overlay", "shell.quota-notice", "sidebar", "sidebar.brand.mark", "sidebar.brand.name", "sidebar.chat.conversation", "sidebar.footer.action", "sidebar.panellist", "sidebar.panellist.actions", "sidebar.right.pane.tab", "sidebar.right.pane.tab.title", "sidebar.right.tab.document", "sidebar.right.tab.document.action", "sidebar.right.tab.document.actions", "sidebar.right.tab.document.office.pdf", "sidebar.right.tab.document.unpreviewable", "sidebar.right.tab.files.actions", "sidebar.right.tab.guide", "sidebar.right.tab.guide.actions", "sidebar.right.tab.guide.entry", "sidebar.right.tab.menu.item", "sidebar.session.row.hover", "sidebar.session.row.leading", "sidebar.settings", "sidebar.toggle.badge", "sidebar.workspaces", "sidebar.workspaces.directoryFlow", "sidebar.workspaces.session.menu.item", "sidebar.workspaces.session.row.action", "tool.call.images", "tool.call.toolview", "tool.view.cordis", "workspace.toast", "dsh-go.panel"],
      "unseatable": ["conversation.approval.detail", "conversation.chat.flow", "conversation.chat.message.images", "conversation.chat.reasoning.body", "conversation.chat.user.images", "conversation.composer.bar", "conversation.header", "conversation.hero.agentPreset", "conversation.hero.workspace", "conversation.hero.workspace.directoryFlow", "conversation.input.activity", "conversation.input.attachments", "conversation.input.model", "conversation.input.model.label", "conversation.input.permission", "conversation.input.plan", "conversation.session", "conversation.session.header", "conversation.session.header.corner", "conversation.session.header.lineage", "conversation.trajectory.images", "main.conversation", "plugins.bundle.activation", "rightbar", "rightbar.session", "root", "settings.close", "settings.header", "settings.launcher", "settings.models.sign-in", "settings.trigger", "shell.bottom", "shell.leading", "sidebar", "sidebar.brand.mark", "sidebar.brand.name", "sidebar.chat.conversation", "sidebar.right.pane.tab.title", "sidebar.settings", "sidebar.toggle.badge", "sidebar.workspaces", "sidebar.workspaces.directoryFlow", "workspace.toast"]
    }
  }
}
